meeting_year,meeting_type,meeting_number,meeting_name,paper_type,paper_number,paper_revision,paper_name,agendas,parties,url
2022,ATCM,44,ATCM XLIV - CEP XXIV,wp,1,0,Revised Management Plan and maps for Antarctic Specially Managed Area No. 7 Southwest Anvers Island and Palmer Basin,CEP 9a,United States,https://documents.ats.aq/ATCM44/wp/ATCM44_wp001_e.docx
2022,ATCM,44,ATCM XLIV - CEP XXIV,wp,2,0,"Revised Management Plan for Antarctic Specially Protected Area No. 149. Cape Shirreff and San Telmo Island, Livingston Island, South Shetland Islands",CEP 9a,United States,https://documents.ats.aq/ATCM44/wp/ATCM44_wp002_e.docx
2022,ATCM,44,ATCM XLIV - CEP XXIV,wp,3,0,"Revised Management Plan for Antarctic Specially Protected Area No. 122. Arrival Heights, Hut Point Peninsula, Ross Island",CEP 9a,United States,https://documents.ats.aq/ATCM44/wp/ATCM44_wp003_e.docx
2022,ATCM,44,ATCM XLIV - CEP XXIV,wp,4,0,"Revised Management Plan for Antarctic Specially Protected Area No. 124. Cape Crozier, Ross Island",CEP 9a,United States,https://documents.ats.aq/ATCM44/wp/ATCM44_wp004_e.docx
2022,ATCM,44,ATCM XLIV - CEP XXIV,wp,5,0,"Review of the Management Plans for Antarctic Specially Protected Areas (ASPAs) No. 113 Litchfield Island, Arthur Harbor, Palmer Archipelago, No. 119 Davis Valley and Forlidas Pond, Dufek Massif, and No. 139 Biscoe Point, Palmer Archipelago",CEP 9a,United States,https://documents.ats.aq/ATCM44/wp/ATCM44_wp005_e.docx
2022,ATCM,44,ATCM XLIV - CEP XXIV,wp,6,0,Revision and merger of the Management Plans for Antarctic Specially Protected Areas No. 152 Western Bransfield Strait and No. 153 Eastern Dallmann Bay,CEP 9a,United States,https://documents.ats.aq/ATCM44/wp/ATCM44_wp006_e.docx
2022,ATCM,44,ATCM XLIV - CEP XXIV,wp,7,0,ATS webpages providing information on the Subsidiary Groups of the CEP,CEP 4,India | Norway | United Kingdom,https://documents.ats.aq/ATCM44/wp/ATCM44_wp007_e.docx
2022,ATCM,44,ATCM XLIV - CEP XXIV,wp,8,1,Subsidiary Group on Management Plans Report of activities during the intersessional period 2021-2022,CEP 9a,India,https://documents.ats.aq/ATCM44/wp/ATCM44_wp008_rev1_e.docx
2022,ATCM,44,ATCM XLIV - CEP XXIV,wp,9,0,Review of the scientific information contained in the EIES,ATCM 10,Spain,https://documents.ats.aq/ATCM44/wp/ATCM44_wp009_e.docx
2022,ATCM,44,ATCM XLIV - CEP XXIV,wp,10,0,Antarctic Environments Portal,ATCM 11,SCAR,https://documents.ats.aq/ATCM44/wp/ATCM44_wp010_e.docx
2022,ATCM,44,ATCM XLIV - CEP XXIV,wp,11,1,Further steps towards a structured sample and data collection of environmental contamination,CEP 11,Germany | Italy | Australia | United Kingdom | United States | Sweden,https://documents.ats.aq/ATCM44/wp/ATCM44_wp011_rev1_e.docx
2022,ATCM,44,ATCM XLIV - CEP XXIV,wp,12,0,"Prior assessment of a proposed Antarctic Specially Protected Area at Otto-von-Gruber-Gebirge (Dronning Maud Land, East Antarctica)",CEP 9a,Germany | United States,https://documents.ats.aq/ATCM44/wp/ATCM44_wp012_e.docx
2022,ATCM,44,ATCM XLIV - CEP XXIV,wp,13,0,Prior assessment of a proposed Antarctic Specially Protected Area at Danger Islands Archipelago (North-eastern Antarctic Peninsula),CEP 9a,Germany | United States,https://documents.ats.aq/ATCM44/wp/ATCM44_wp013_e.docx
2022,ATCM,44,ATCM XLIV - CEP XXIV,wp,14,0,Do the Environmental Guidelines for operation of Remotely Piloted Air-craft Systems (RPAS) in Antarctica (v 1.1) need to be revised?,CEP 10c,Germany,https://documents.ats.aq/ATCM44/wp/ATCM44_wp014_e.docx
2022,ATCM,44,ATCM XLIV - CEP XXIV,wp,15,0,"Proposal for a new Antarctic Specially Protected Area in parts of the Western Sør Rondane Mountains, Dronning Maud Land, East Antarctic",CEP 9a,Belgium,https://documents.ats.aq/ATCM44/wp/ATCM44_wp015_e.docx
2022,ATCM,44,ATCM XLIV - CEP XXIV,wp,16,0,Review of progress in the implementation of the recommendations identified at the Joint CEP/SC-CAMLR Workshop on Climate Change and Monitoring (2016),CEP 7b,Argentina | Australia | France | United States,https://documents.ats.aq/ATCM44/wp/ATCM44_wp016_e.docx
2022,ATCM,44,ATCM XLIV - CEP XXIV,wp,17,0,Additional COMNAP advice in regards to ATCM review of Resolution on Air Safety in Antarctica,ATCM 13,COMNAP,https://documents.ats.aq/ATCM44/wp/ATCM44_wp017_e.docx
2022,ATCM,44,ATCM XLIV - CEP XXIV,wp,18,0,Report on emergency plans and implementation of natural disaster risk assessment at Antarctic stations,ATCM 13,COMNAP,https://documents.ats.aq/ATCM44/wp/ATCM44_wp018_e.docx
2022,ATCM,44,ATCM XLIV - CEP XXIV,wp,19,0,"Revision of the Management Plan for Antarctic Specially Protected Area (ASPA) No. 164 Scullin and Murray Monoliths, Mac.Robertson Land",CEP 9a,Australia,https://documents.ats.aq/ATCM44/wp/ATCM44_wp019_e.docx
2022,ATCM,44,ATCM XLIV - CEP XXIV,wp,20,0,Type localities in Antarctica,CEP 9e,Australia,https://documents.ats.aq/ATCM44/wp/ATCM44_wp020_e.docx
2022,ATCM,44,ATCM XLIV - CEP XXIV,wp,21,0,Communication of CEP science needs to researchers and national science funding agencies,CEP 13,Norway | United Kingdom,https://documents.ats.aq/ATCM44/wp/ATCM44_wp021_e.docx
2022,ATCM,44,ATCM XLIV - CEP XXIV,wp,22,0,Towards adaptive and sustainable management of Antarctic tourism: Monitoring as a key tool for decision-making,ATCM 17 | CEP 11,Ecuador | Spain | United States,https://documents.ats.aq/ATCM44/wp/ATCM44_wp022_e.docx
2022,ATCM,44,ATCM XLIV - CEP XXIV,wp,23,0,Fifth report of the Intersessional Contact Group on Education and Outreach,ATCM 11,Bulgaria | Belgium | Brazil | Chile | Portugal | Spain | United Kingdom,https://documents.ats.aq/ATCM44/wp/ATCM44_wp023_e.docx
2022,ATCM,44,ATCM XLIV - CEP XXIV,wp,24,0,An Overview on the Legal Framework on Antarctic Specially Protected Species and Its Application,ATCM 6b | CEP 10b,China,https://documents.ats.aq/ATCM44/wp/ATCM44_wp024_e.docx
2022,ATCM,44,ATCM XLIV - CEP XXIV,wp,25,0,Important Marine Mammals Areas (IMMAs),CEP 10c,France | United Kingdom | Chile | Germany | Monaco | South Africa,https://documents.ats.aq/ATCM44/wp/ATCM44_wp025_e.docx
2022,ATCM,44,ATCM XLIV - CEP XXIV,wp,26,0,Assessing the risk of climate change impacts on Antarctic heritage values,CEP 7b,Argentina | New Zealand | Norway | United Kingdom,https://documents.ats.aq/ATCM44/wp/ATCM44_wp026_e.docx
2022,ATCM,44,ATCM XLIV - CEP XXIV,wp,27,0,Revisiting CEP strategic priorities and the CEP Five-Year Work Plan,CEP 3,Norway,https://documents.ats.aq/ATCM44/wp/ATCM44_wp027_e.docx
2022,ATCM,44,ATCM XLIV - CEP XXIV,wp,28,0,Guidance for Conservation Management Planning for Historic Sites and Monuments in Antarctica,CEP 9b,United Kingdom | Australia | New Zealand | Norway | United States,https://documents.ats.aq/ATCM44/wp/ATCM44_wp028_e.docx
2022,ATCM,44,ATCM XLIV - CEP XXIV,wp,29,0,Antarctica in a Changing Climate – Implementing ATCM Resolution 8 (2021),ATCM 16,United Kingdom | Australia | Belgium | Finland | France | Germany | Netherlands | Norway | Sweden | United States | SCAR | ASOC,https://documents.ats.aq/ATCM44/wp/ATCM44_wp029_e.docx
2022,ATCM,44,ATCM XLIV - CEP XXIV,wp,30,1,Antarctic Climate Change and the Environment: A Decadal Synopsis. Findings and Policy Recommendations,ATCM 16 | CEP 7a,SCAR,https://documents.ats.aq/ATCM44/wp/ATCM44_wp030_rev1_e.docx
2022,ATCM,44,ATCM XLIV - CEP XXIV,wp,31,1,Antarctic Climate Change and the Environment: A Decadal Synopsis. Research Imperatives,ATCM 16 | CEP 7a,SCAR,https://documents.ats.aq/ATCM44/wp/ATCM44_wp031_rev1_e.docx
2022,ATCM,44,ATCM XLIV - CEP XXIV,wp,32,0,Revision of the Management Plan for Antarctic Specially Protected Area No 127 “Haswell Island” (Haswell Island and the adjacent fast ice field with a colony of emperor penguins),CEP 9a,Russian Federation,https://documents.ats.aq/ATCM44/wp/ATCM44_wp032_e.docx
2022,ATCM,44,ATCM XLIV - CEP XXIV,wp,33,0,Report on Effectiveness of Environmental Impact Assessment in Antarctica,ATCM 6b | CEP 8b,United Kingdom | Netherlands,https://documents.ats.aq/ATCM44/wp/ATCM44_wp033_e.docx
2022,ATCM,44,ATCM XLIV - CEP XXIV,wp,34,0,Report of the CEP Intersessional Contact Group established to develop a Specially Protected Species Action Plan for the emperor penguin,CEP 10b,United Kingdom,https://documents.ats.aq/ATCM44/wp/ATCM44_wp034_e.docx
2022,ATCM,44,ATCM XLIV - CEP XXIV,wp,35,0,Proposal for Development of a Targeted Research and Monitoring Plan for the Emperor Penguins,CEP 10b,China,https://documents.ats.aq/ATCM44/wp/ATCM44_wp035_e.docx
2022,ATCM,44,ATCM XLIV - CEP XXIV,wp,36,0,Report of the Intersessional Contact Group on Permanent Facilities for Tourism and other Non-Governmental Activities in Antarctica,ATCM 17,Netherlands,https://documents.ats.aq/ATCM44/wp/ATCM44_wp036_e.docx
2022,ATCM,44,ATCM XLIV - CEP XXIV,wp,37,0,Report of the CEP Subsidiary Group on Climate Change Response (SGCCR) 2021-2022,CEP 7b,United Kingdom,https://documents.ats.aq/ATCM44/wp/ATCM44_wp037_e.docx
2022,ATCM,44,ATCM XLIV - CEP XXIV,wp,38,0,"Prior assessment of a proposed Antarctic Specially Protected Area on Farrier Col, Horseshoe Island, Marguerite Bay",CEP 9a,Belgium | Türkiye | United Kingdom,https://documents.ats.aq/ATCM44/wp/ATCM44_wp038_e.docx
2022,ATCM,44,ATCM XLIV - CEP XXIV,wp,39,0,Mapping coastline sensitivity to oil pollution in the Antarctic Peninsula region,CEP 8b,United Kingdom,https://documents.ats.aq/ATCM44/wp/ATCM44_wp039_e.docx
2022,ATCM,44,ATCM XLIV - CEP XXIV,wp,40,0,"Revision of the Management Plan for Antarctic Specially Protected Area (ASPA) No. 109 Moe Island, South Orkney Islands",CEP 9a,United Kingdom,https://documents.ats.aq/ATCM44/wp/ATCM44_wp040_e.docx
2022,ATCM,44,ATCM XLIV - CEP XXIV,wp,41,0,"Revision of the Management Plan for Antarctic Specially Protected Area (ASPA) No. 110 Lynch Island, South Orkney Islands",CEP 9a,United Kingdom,https://documents.ats.aq/ATCM44/wp/ATCM44_wp041_e.docx
2022,ATCM,44,ATCM XLIV - CEP XXIV,wp,42,0,"Revision of the Management Plan for Antarctic Specially Protected Area (ASPA) No. 111 Southern Powell Island and adjacent islands, South Orkney Islands",CEP 9a,United Kingdom,https://documents.ats.aq/ATCM44/wp/ATCM44_wp042_e.docx
2022,ATCM,44,ATCM XLIV - CEP XXIV,wp,43,0,"Revision of the Management Plan for Antarctic Specially Protected Area (ASPA) No. 115 Lagotellerie Island, Marguerite Bay, Graham Land",CEP 9a,United Kingdom,https://documents.ats.aq/ATCM44/wp/ATCM44_wp043_e.docx
2022,ATCM,44,ATCM XLIV - CEP XXIV,wp,44,0,"Revised Management Plan for Antarctic Specially Protected Area No. 126 Byers Peninsula, Livingston Island, South Shetland Islands",CEP 9a,United Kingdom | Chile | Spain,https://documents.ats.aq/ATCM44/wp/ATCM44_wp044_e.docx
2022,ATCM,44,ATCM XLIV - CEP XXIV,wp,45,0,"Revision of the Management Plan for Antarctic Specially Protected Area (ASPA) No. 129 Rothera Point, Adelaide Island",CEP 9a,United Kingdom,https://documents.ats.aq/ATCM44/wp/ATCM44_wp045_e.docx
2022,ATCM,44,ATCM XLIV - CEP XXIV,wp,46,0,"Revision of the Management Plan for Antarctic Specially Protected Area (ASPA) No. 140 Parts of Deception Island, South Shetland Islands",CEP 9a,United Kingdom | Spain,https://documents.ats.aq/ATCM44/wp/ATCM44_wp046_e.docx
2022,ATCM,44,ATCM XLIV - CEP XXIV,wp,47,0,Discovery of the wreck of Endurance - Updating information for HSM 93 and Development of a Management Plan,CEP 9b,United Kingdom | South Africa,https://documents.ats.aq/ATCM44/wp/ATCM44_wp047_e.docx
2022,ATCM,44,ATCM XLIV - CEP XXIV,wp,48,0,The Implementation of the Climate Change Response Working Programme,ATCM 16 | CEP 7b,China,https://documents.ats.aq/ATCM44/wp/ATCM44_wp048_e.docx
2022,ATCM,44,ATCM XLIV - CEP XXIV,wp,49,0,"Revised Visitor Site Guidelines for Site No. 22 Wordie House, Winter Island",CEP 9c,Ukraine | United Kingdom,https://documents.ats.aq/ATCM44/wp/ATCM44_wp049_e.docx
2022,ATCM,44,ATCM XLIV - CEP XXIV,wp,50,0,"Continuing Discussion on Relevant Issues, Trends and Challenges to the Antarctic Treaty System",ATCM 6b,Russian Federation,https://documents.ats.aq/ATCM44/wp/ATCM44_wp050_e.docx
2022,ATCM,44,ATCM XLIV - CEP XXIV,wp,51,0,Report of the Informal Discussion on Post-Visit Reports,ATCM 17,Argentina,https://documents.ats.aq/ATCM44/wp/ATCM44_wp051_e.docx
2022,ATCM,44,ATCM XLIV - CEP XXIV,wp,52,0,Proposal for Modifications to the Location Coordinates of Nine Historic Sites and Monuments,CEP 9b,Argentina,https://documents.ats.aq/ATCM44/wp/ATCM44_wp052_e.docx
2022,ATCM,44,ATCM XLIV - CEP XXIV,wp,53,0,"Revision of the Management Plan for Antarctic Specially Protected Area (ASPA) No. 133, Harmony Point, Nelson Island, South Shetland Islands",CEP 9a,Argentina | Chile,https://documents.ats.aq/ATCM44/wp/ATCM44_wp053_e.docx
